title,year,doi,url,source_query,abstract,category,relevance_score,problem_claimed,mechanism_introduced,hidden_assumptions,failure_modes_ignored,what_makes_less_novel,what_it_leaves_open
Robot Manipulation based on Machine Learning,2023,10.31219/osf.io/dtw43,https://doi.org/10.31219/osf.io/dtw43,safe probing robot manipulation uncertainty,"Most manipulation systems are created based on thepremise that the items being handled are stiff and do not deformwhen grasped. The issue of robotic grasping and manipulation of3-D deformable objects, like rubber balls or sand-filled bags, isdiscussed in this work. We have specifically created a generalisedlearning technique for managing 3-D deformable objects thatdoes not require prior knowledge of object attributes and can beused with a wide variety of object kinds. The execution of two keyduties is the foundation of our methodology. Our first job is todetermine the deformation properties of a non-rigid object thatis modelled physically. In order to determine the deformationproperties, we model the particle motion of the deformableobject using nonlinear partial differential equations. In orderto successfully lift the deformable object, we must determine thesmallest force necessary. Ite",embodied-manipulation,4,choosing robot actions under model uncertainty,learned predictive representation,uncertainty scores are calibrated enough to guide action,miscalibration under embodied distribution shift,can collapse into a standard uncertainty bonus,which physical observation would actually distinguish the candidate models?
Erratum: A Surgical Robotic Framework for Safe and Autonomous Data-Driven Learning and Manipulation of an Unknown Deformable Tissue with an Integrated Critical Space,2023,10.1142/s2424905x23920010,https://doi.org/10.1142/s2424905x23920010,safe probing robot manipulation uncertainty,,embodied-manipulation,4,choosing robot actions under model uncertainty,learned predictive representation,uncertainty scores are calibrated enough to guide action,miscalibration under embodied distribution shift,can collapse into a standard uncertainty bonus,which physical observation would actually distinguish the candidate models?
An Ensemble Energy Consumption Prediction Model for Industrial Serial-Robot,2022,10.1109/ccdc55256.2022.10033724,https://doi.org/10.1109/ccdc55256.2022.10033724,robot world model ensemble disagreement,,model-disagreement,4,choosing robot actions under model uncertainty,ensemble disagreement,uncertainty scores are calibrated enough to guide action,ensembles disagree numerically without identifying a physical test,can collapse into a standard uncertainty bonus,which physical observation would actually distinguish the candidate models?
Design of Simulink-based 3D Hexapod Robot Model and Implementation of Hexapod Robot Foothold Planning,2022,10.25236/ajcis.2022.050307,https://doi.org/10.25236/ajcis.2022.050307,embodied uncertainty planning robot model disagreement,,planning-control,4,planning with learned predictive models,learned predictive representation,uncertainty scores are calibrated enough to guide action,miscalibration under embodied distribution shift,can collapse into a standard uncertainty bonus,which physical observation would actually distinguish the candidate models?
Pose Estimation for Robot Manipulators via Keypoint Optimization and Sim-to-Real Transfer,2022,10.1109/lra.2022.3151981,https://doi.org/10.1109/lra.2022.3151981,sim-to-real world model ensemble robot,,sim2real,4,transfer under dynamics mismatch,learned predictive representation,uncertainty scores are calibrated enough to guide action,miscalibration under embodied distribution shift,can collapse into a standard uncertainty bonus,which physical observation would actually distinguish the candidate models?
Sim–Real Mapping of an Image-Based Robot Arm Controller Using Deep Reinforcement Learning,2022,10.3390/app122010277,https://doi.org/10.3390/app122010277,sim-to-real world model ensemble robot,"Models trained with Deep Reinforcement learning (DRL) have been deployed in various areas of robotics with varying degree of success. To overcome the limitations of data gathering in the real world, DRL training utilizes simulated environments and transfers the learned policy to real-world scenarios, i.e., sim–real transfer. Simulators fail to accurately capture the entire dynamics of the real world, so simulation-trained policies often fail when applied to reality, termed a reality gap (RG). In this paper, we propose a search (mapping) algorithm that takes in real-world observation (images) and maps them to the policy-equivalent images in the simulated environment using a convolution neural network (CNN) model. The two-step training process, DRL policy and a mapping model, overcomes the RG problem with simulated data only. We evaluated the proposed system with a gripping task of a custo",planning-control|sim2real,4,transfer under dynamics mismatch,learned predictive representation,uncertainty scores are calibrated enough to guide action,miscalibration under embodied distribution shift,can collapse into a standard uncertainty bonus,which physical observation would actually distinguish the candidate models?
Sim-to-real localization: Environment resilient deep ensemble learning for guided wave damage localization,2022,10.1121/10.0009580,https://doi.org/10.1121/10.0009580,sim-to-real world model ensemble robot,"Guided ultrasonic wave localization systems use spatially distributed sensor arrays and wave propagation models to detect and locate damage across a structure. Environmental and operational conditions, such as temperature or stress variations, introduce uncertainty into guided wave data and reduce the effectiveness of these localization systems. These uncertainties cause the models used by each localization algorithm to fail to match with reality. This paper addresses this challenge with an ensemble deep neural network that is trained solely with simulated data. Relative to delay-and-sum and matched field processing strategies, this approach is demonstrated to be more robust to temperature variations in experimental data. As a result, this approach demonstrates superior accuracy with small numbers of sensors and greater resilience to spatially nonhomogeneous temperature variations over t",model-disagreement|uncertainty|sim2real,4,transfer under dynamics mismatch,ensemble disagreement,uncertainty scores are calibrated enough to guide action,ensembles disagree numerically without identifying a physical test,can collapse into a standard uncertainty bonus,which physical observation would actually distinguish the candidate models?
Bioinspired and Energy-Efficient Convex Model Predictive Control for a Quadruped Robot,2022,10.20537/nd221214,https://doi.org/10.20537/nd221214,model predictive control ensemble disagreement robot,"Animal running has been studied for a long time, but until now robots cannot repeat the same movements with energy efficiency close to animals. There are many controllers for controlling the movement of four-legged robots. One of the most popular is the convex MPC. This paper presents a bioinspirational approach to increasing the energy efficiency of the state-of-the-art convex MPC controller. This approach is to set a reference trajectory for the convex MPC in the form of an SLIP model, which describes the movements of animals when running. Adding an SLIP trajectory increases the energy efficiency of the Pronk gait by 15 percent over a range of speed from 0.75 m/s to 1.75 m/s.",planning-control,4,choosing robot actions under model uncertainty,learned predictive representation,uncertainty scores are calibrated enough to guide action,miscalibration under embodied distribution shift,can collapse into a standard uncertainty bonus,which physical observation would actually distinguish the candidate models?
Catching Objects with a Robot Arm using Model Predictive Control,2022,10.23919/acc53348.2022.9867380,https://doi.org/10.23919/acc53348.2022.9867380,model predictive control ensemble disagreement robot,,planning-control,4,choosing robot actions under model uncertainty,learned predictive representation,uncertainty scores are calibrated enough to guide action,miscalibration under embodied distribution shift,can collapse into a standard uncertainty bonus,which physical observation would actually distinguish the candidate models?
Model Predictive Control of Running Biped Robot,2022,10.3390/app122111183,https://doi.org/10.3390/app122111183,model predictive control ensemble disagreement robot,"With the feet of a biped robot attached insecurely to a terrain, its stability is strongly affected by the characteristics of the terrain on which it runs. Therefore, for stable bipedal running, online motion control based on the states of the robot and the environment is needed. This paper proposes a method for online motion control of a running biped robot on an uneven terrain based on a dual linear inverted pendulum model (D-LIPM) and hierarchical control which consists of linear model predictive control (MPC) and quadratic-problem (QP) based momentum control. The D-LIPM, which splits the nonlinear dynamics model of the running biped robot into two linear models under some assumptions, is proposed to generate the running motion through linear MPC. The D-LIPM is applied to the proposed hierarchical control for stable bipedal running. In the first stage of hierarchy, linear MPC is emplo",world-model|planning-control,4,choosing robot actions under model uncertainty,learned predictive representation,uncertainty scores are calibrated enough to guide action,miscalibration under embodied distribution shift,can collapse into a standard uncertainty bonus,which physical observation would actually distinguish the candidate models?
Model Predictive Control Using Dynamic Model Decomposition Applied to Two-Wheeled Inverted Pendulum Mobile Robot,2022,10.1109/ur55393.2022.9826244,https://doi.org/10.1109/ur55393.2022.9826244,model predictive control ensemble disagreement robot,,planning-control,4,choosing robot actions under model uncertainty,learned predictive representation,uncertainty scores are calibrated enough to guide action,miscalibration under embodied distribution shift,can collapse into a standard uncertainty bonus,which physical observation would actually distinguish the candidate models?
Self-healing control method combining model predictive control and restart strategy for 4WD mobile robot,2022,10.1109/ccdc55256.2022.10033704,https://doi.org/10.1109/ccdc55256.2022.10033704,model predictive control ensemble disagreement robot,,planning-control,4,choosing robot actions under model uncertainty,learned predictive representation,uncertainty scores are calibrated enough to guide action,miscalibration under embodied distribution shift,can collapse into a standard uncertainty bonus,which physical observation would actually distinguish the candidate models?
Mobile Robot Model Predictive Control Model,2022,10.1109/scm55405.2022.9794835,https://doi.org/10.1109/scm55405.2022.9794835,model predictive control ensemble disagreement robot,,planning-control,4,choosing robot actions under model uncertainty,learned predictive representation,uncertainty scores are calibrated enough to guide action,miscalibration under embodied distribution shift,can collapse into a standard uncertainty bonus,which physical observation would actually distinguish the candidate models?
Application of Model Predictive Control to Polishing Robot for Pushing Operation,2022,10.23919/iccas55662.2022.10003683,https://doi.org/10.23919/iccas55662.2022.10003683,model predictive control ensemble disagreement robot,,planning-control,4,choosing robot actions under model uncertainty,learned predictive representation,uncertainty scores are calibrated enough to guide action,miscalibration under embodied distribution shift,can collapse into a standard uncertainty bonus,which physical observation would actually distinguish the candidate models?
Approximate Time-Optimal Model Predictive Control of a SCARA Robot: A Case Study,2022,10.3311/minisy2022-003,https://doi.org/10.3311/minisy2022-003,model predictive control ensemble disagreement robot,,planning-control,4,choosing robot actions under model uncertainty,learned predictive representation,uncertainty scores are calibrated enough to guide action,miscalibration under embodied distribution shift,can collapse into a standard uncertainty bonus,which physical observation would actually distinguish the candidate models?
Research on Surface Tracking Method of Industrial Robot Based on Model Predictive Control,2022,10.3901/jme.2022.19.024,https://doi.org/10.3901/jme.2022.19.024,model predictive control ensemble disagreement robot,,planning-control,4,choosing robot actions under model uncertainty,learned predictive representation,uncertainty scores are calibrated enough to guide action,miscalibration under embodied distribution shift,can collapse into a standard uncertainty bonus,which physical observation would actually distinguish the candidate models?
Robust Model Predictive Control for Robot Manipulators,2022,10.1109/humanoids53995.2022.10000136,https://doi.org/10.1109/humanoids53995.2022.10000136,model predictive control ensemble disagreement robot,,planning-control,4,choosing robot actions under model uncertainty,learned predictive representation,uncertainty scores are calibrated enough to guide action,miscalibration under embodied distribution shift,can collapse into a standard uncertainty bonus,which physical observation would actually distinguish the candidate models?
Action Planning and Design of Humanoid Robot Based on Sports Analysis in Digital Economy Era,2022,10.38007/ijmc.2022.030106,https://doi.org/10.38007/ijmc.2022.030106,robot foundation model uncertainty action planning,,planning-control,4,planning with learned predictive models,learned predictive representation,uncertainty scores are calibrated enough to guide action,miscalibration under embodied distribution shift,can collapse into a standard uncertainty bonus,which physical observation would actually distinguish the candidate models?
RETRACTED: Robot Path Planning Method Based on Indoor Spacetime Grid Model,2022,10.3390/rs14102357,https://doi.org/10.3390/rs14102357,robot foundation model uncertainty action planning,"In the context of digital twins, smart city construction and artificial intelligence technology are developing rapidly, and more and more mobile robots are performing tasks in complex and time-varying indoor environments, making, at present, the unification of modeling, dynamic expression, visualization of operation, and wide application between robots and indoor environments a pressing problem to be solved. This paper presents an in-depth study on this issue and summarizes three major types of methods: geometric modeling, topological modeling, and raster modeling, and points out the advantages and disadvantages of these three types of methods. Therefore, in view of the current pain points of robots and complex time-varying indoor environments, this paper proposes an indoor spacetime grid model based on the three-dimensional division framework of the Earth space and innovatively integrat",planning-control,4,planning with learned predictive models,learned predictive representation,uncertainty scores are calibrated enough to guide action,miscalibration under embodied distribution shift,can collapse into a standard uncertainty bonus,which physical observation would actually distinguish the candidate models?
Humanoid Trajectory Planning for Robot Based on Minimum-Jerk Model of Human Arm,2022,10.1109/cacre54574.2022.9834199,https://doi.org/10.1109/cacre54574.2022.9834199,robot foundation model uncertainty action planning,,planning-control,4,planning with learned predictive models,learned predictive representation,uncertainty scores are calibrated enough to guide action,miscalibration under embodied distribution shift,can collapse into a standard uncertainty bonus,which physical observation would actually distinguish the candidate models?
Using meta-reasoning for incremental repairs in multi-object robot manipulation tasks,2022,10.3389/fphy.2022.975247,https://doi.org/10.3389/fphy.2022.975247,physics reasoning robot world models,Robots tasked with object assembly by manipulation of parts require not only a high-level plan for order of placement of parts but also detailed low-level information on how to place and pick the part based on its state. This is a complex multi-level problem prone to failures at various levels. This paper employs meta reasoning architecture along with robotics principles and proposes dual encoding of state expectations during the progression of task to ground nominal scenarios. We present our results on table-top scenario using perceptual expectations based in the concept of occupancy grids and key point representations. Our results in a constrained manipulation setting suggest using low-level information or high-level expectations alone the system performs worse than if the architecture uses them both. We then outline a complete architecture and system which tackles this problem for rep,embodied-manipulation,4,choosing robot actions under model uncertainty,learned predictive representation,uncertainty scores are calibrated enough to guide action,miscalibration under embodied distribution shift,can collapse into a standard uncertainty bonus,which physical observation would actually distinguish the candidate models?
Two ways to make your robot proactive: Reasoning about human intentions or reasoning about possible futures,2022,10.3389/frobt.2022.929267,https://doi.org/10.3389/frobt.2022.929267,physics reasoning robot world models,"Robots sharing their space with humans need to be proactive to be helpful. Proactive robots can act on their own initiatives in an anticipatory way to benefit humans. In this work, we investigate two ways to make robots proactive. One way is to recognize human intentions and to act to fulfill them, like opening the door that you are about to cross. The other way is to reason about possible future threats or opportunities and to act to prevent or to foster them, like recommending you to take an umbrella since rain has been forecast. In this article, we present approaches to realize these two types of proactive behavior. We then present an integrated system that can generate proactive robot behavior by reasoning on both factors: intentions and predictions. We illustrate our system on a sample use case including a domestic robot and a human. We first run this use case with the two separate ",active-probing,4,choosing robot actions under model uncertainty,active data acquisition,uncertainty scores are calibrated enough to guide action,"query cost, unsafe probes, and exploration bias",can collapse into a standard uncertainty bonus,which physical observation would actually distinguish the candidate models?
Few-Shot Continual Active Learning by a Robot,2022,10.52202/068431-2219,https://doi.org/10.52202/068431-2219,robot exploration uncertainty active learning,,active-probing,4,choosing robot actions under model uncertainty,active data acquisition,uncertainty scores are calibrated enough to guide action,"query cost, unsafe probes, and exploration bias",can collapse into a standard uncertainty bonus,which physical observation would actually distinguish the candidate models?
Geometric Problems in Robot Exploration,2022,10.31390/gradschool_dissertations.4930,https://doi.org/10.31390/gradschool_dissertations.4930,robot exploration uncertainty active learning,,active-probing,4,choosing robot actions under model uncertainty,active data acquisition,uncertainty scores are calibrated enough to guide action,miscalibration under embodied distribution shift,can collapse into a standard uncertainty bonus,which physical observation would actually distinguish the candidate models?
AEGQ: A Novel Autonomous Exploration Algorithm for Mobile Robot in Unknown Environments Using Deep Learning,2022,10.2139/ssrn.4243425,https://doi.org/10.2139/ssrn.4243425,robot exploration uncertainty active learning,,active-probing,4,choosing robot actions under model uncertainty,active data acquisition,uncertainty scores are calibrated enough to guide action,miscalibration under embodied distribution shift,can collapse into a standard uncertainty bonus,which physical observation would actually distinguish the candidate models?
Cognitive Robot Manipulation,2022,10.7551/mitpress/13780.003.0022,https://doi.org/10.7551/mitpress/13780.003.0022,safe probing robot manipulation uncertainty,,embodied-manipulation,4,choosing robot actions under model uncertainty,learned predictive representation,uncertainty scores are calibrated enough to guide action,miscalibration under embodied distribution shift,can collapse into a standard uncertainty bonus,which physical observation would actually distinguish the candidate models?
A geometric approach to robotic manipulation in physical human-robot interaction,2022,10.3990/1.9789036553568,https://doi.org/10.3990/1.9789036553568,safe probing robot manipulation uncertainty,,embodied-manipulation,4,choosing robot actions under model uncertainty,learned predictive representation,uncertainty scores are calibrated enough to guide action,miscalibration under embodied distribution shift,can collapse into a standard uncertainty bonus,which physical observation would actually distinguish the candidate models?
Uncertainty-Aware Manipulation Planning Using Gravity and Environment Geometry,2022,10.1109/lra.2022.3207565,https://doi.org/10.1109/lra.2022.3207565,safe probing robot manipulation uncertainty,,uncertainty|embodied-manipulation|planning-control,4,planning with learned predictive models,learned predictive representation,uncertainty scores are calibrated enough to guide action,miscalibration under embodied distribution shift,can collapse into a standard uncertainty bonus,which physical observation would actually distinguish the candidate models?
Robot Dynamic Manipulation,2022,10.1007/978-3-030-93290-9,https://doi.org/10.1007/978-3-030-93290-9,safe probing robot manipulation uncertainty,,embodied-manipulation,4,choosing robot actions under model uncertainty,learned predictive representation,uncertainty scores are calibrated enough to guide action,miscalibration under embodied distribution shift,can collapse into a standard uncertainty bonus,which physical observation would actually distinguish the candidate models?
Reconfigurable Magnetic Liquid Metal Robot for High-Performance Droplet Manipulation,2022,10.1021/acs.nanolett.2c00100.s003,https://doi.org/10.1021/acs.nanolett.2c00100.s003,safe probing robot manipulation uncertainty,,embodied-manipulation,4,choosing robot actions under model uncertainty,learned predictive representation,uncertainty scores are calibrated enough to guide action,miscalibration under embodied distribution shift,can collapse into a standard uncertainty bonus,which physical observation would actually distinguish the candidate models?
Reconfigurable Magnetic Liquid Metal Robot for High-Performance Droplet Manipulation,2022,10.1021/acs.nanolett.2c00100.s009,https://doi.org/10.1021/acs.nanolett.2c00100.s009,safe probing robot manipulation uncertainty,,embodied-manipulation,4,choosing robot actions under model uncertainty,learned predictive representation,uncertainty scores are calibrated enough to guide action,miscalibration under embodied distribution shift,can collapse into a standard uncertainty bonus,which physical observation would actually distinguish the candidate models?
Reconfigurable Magnetic Liquid Metal Robot for High-Performance Droplet Manipulation,2022,10.1021/acs.nanolett.2c00100.s004,https://doi.org/10.1021/acs.nanolett.2c00100.s004,safe probing robot manipulation uncertainty,,embodied-manipulation,4,choosing robot actions under model uncertainty,learned predictive representation,uncertainty scores are calibrated enough to guide action,miscalibration under embodied distribution shift,can collapse into a standard uncertainty bonus,which physical observation would actually distinguish the candidate models?
Reconfigurable Magnetic Liquid Metal Robot for High-Performance Droplet Manipulation,2022,10.1021/acs.nanolett.2c00100.s006,https://doi.org/10.1021/acs.nanolett.2c00100.s006,safe probing robot manipulation uncertainty,,embodied-manipulation,4,choosing robot actions under model uncertainty,learned predictive representation,uncertainty scores are calibrated enough to guide action,miscalibration under embodied distribution shift,can collapse into a standard uncertainty bonus,which physical observation would actually distinguish the candidate models?
Reconfigurable Magnetic Liquid Metal Robot for High-Performance Droplet Manipulation,2022,10.1021/acs.nanolett.2c00100.s011,https://doi.org/10.1021/acs.nanolett.2c00100.s011,safe probing robot manipulation uncertainty,,embodied-manipulation,4,choosing robot actions under model uncertainty,learned predictive representation,uncertainty scores are calibrated enough to guide action,miscalibration under embodied distribution shift,can collapse into a standard uncertainty bonus,which physical observation would actually distinguish the candidate models?
Reconfigurable Magnetic Liquid Metal Robot for High-Performance Droplet Manipulation,2022,10.1021/acs.nanolett.2c00100.s002,https://doi.org/10.1021/acs.nanolett.2c00100.s002,safe probing robot manipulation uncertainty,,embodied-manipulation,4,choosing robot actions under model uncertainty,learned predictive representation,uncertainty scores are calibrated enough to guide action,miscalibration under embodied distribution shift,can collapse into a standard uncertainty bonus,which physical observation would actually distinguish the candidate models?
