title,year,doi,url,source_query,abstract,category,relevance_score,problem_claimed,mechanism_introduced,hidden_assumptions,failure_modes_ignored,what_makes_less_novel,what_it_leaves_open
"Effects of Identity, Uncertainty, and Language Contact on Intergroup Relations",2025,10.5642/cguetd.cdjk2532,https://doi.org/10.5642/cguetd.cdjk2532,contact-rich manipulation world model uncertainty,"Despite sixty years of research examining both direct (Allport 1954; Pettigrew &amp; Tropp, 2006) and indirect forms of contact (Wright et al., 1997), less is known about the power of contact with an outgroup language to shape intergroup relations. To address this lacuna in the research, the two current studies examined two potential contextual factors that may impact whether outgroup language contact worsens or improves attitudes and action tendencies toward Latinos in the United States. Specifically, whether or not an outgroup is viewed as having status and power as a distinct group and whether this perception as a distinctive group induces uncertainty about one’s own group membership (Hogg, 2000, 2007, 2012a, 2012b; Stephan et al., 2002). When uncertainty is induced, people should strengthen their identification with their linguistic identities and worsen attitudes and action tendenci",uncertainty|embodied-manipulation,3,embodied prediction under contact ambiguity,learned predictive representation,contact observations are timely and geometrically aligned,miscalibration under embodied distribution shift,can collapse into a standard uncertainty bonus,which physical observation would actually distinguish the candidate models?
Multi-rate model predictive control based tracking control for on-orbit manipulation through contact,2025,10.1360/sspma-2024-0285,https://doi.org/10.1360/sspma-2024-0285,contact-rich manipulation world model uncertainty,,embodied-manipulation|planning-control,3,embodied prediction under contact ambiguity,learned predictive representation,contact observations are timely and geometrically aligned,miscalibration under embodied distribution shift,can collapse into a standard uncertainty bonus,which physical observation would actually distinguish the candidate models?
"&lt;span&gt;Handling Compounded Uncertainty in Spatial Planning and Humanitarian Action in Unexpected Floods in Wayanad, Kerala: Towards a Contextualised Contingency Planning Approach&lt;/span&gt;",2025,10.2139/ssrn.5378560,https://doi.org/10.2139/ssrn.5378560,robot foundation model uncertainty action planning,,uncertainty|planning-control,3,planning with learned predictive models,learned predictive representation,uncertainty scores are calibrated enough to guide action,miscalibration under embodied distribution shift,can collapse into a standard uncertainty bonus,which physical observation would actually distinguish the candidate models?
RA-RRTV*: Risk-Averse RRT* With Local Vine Expansion for Path Planning in Narrow Passages Under Localization Uncertainty,2025,10.1109/lra.2025.3528675,https://doi.org/10.1109/lra.2025.3528675,robot foundation model uncertainty action planning,,uncertainty|planning-control,3,planning with learned predictive models,learned predictive representation,uncertainty scores are calibrated enough to guide action,miscalibration under embodied distribution shift,can collapse into a standard uncertainty bonus,which physical observation would actually distinguish the candidate models?
Inspection Planning Under Execution Uncertainty,2025,10.1109/tro.2025.3548528,https://doi.org/10.1109/tro.2025.3548528,robot foundation model uncertainty action planning,,uncertainty|planning-control,3,planning with learned predictive models,learned predictive representation,uncertainty scores are calibrated enough to guide action,miscalibration under embodied distribution shift,can collapse into a standard uncertainty bonus,which physical observation would actually distinguish the candidate models?
Multi-Investment Two-Stage Stochastic Optimal Planning Model Considering Uncertainty and Remuneration,2025,10.1109/isgteurope64741.2025.11305341,https://doi.org/10.1109/isgteurope64741.2025.11305341,robot foundation model uncertainty action planning,,uncertainty|planning-control,3,planning with learned predictive models,learned predictive representation,uncertainty scores are calibrated enough to guide action,miscalibration under embodied distribution shift,can collapse into a standard uncertainty bonus,which physical observation would actually distinguish the candidate models?
Advancing Diabetic Retinopathy Detection: Reducing Misdiagnosis Using Deep Ensemble Learning and Uncertainty Estimation,2025,10.36227/techrxiv.174889600.07179049/v1,https://doi.org/10.36227/techrxiv.174889600.07179049/v1,active learning robotics uncertainty ensemble,,model-disagreement|uncertainty,3,choosing robot actions under model uncertainty,ensemble disagreement,uncertainty scores are calibrated enough to guide action,ensembles disagree numerically without identifying a physical test,can collapse into a standard uncertainty bonus,which physical observation would actually distinguish the candidate models?
Diabetic Retinopathy Detection with Uncertainty scores: A Combined Approach Using Transfer Learning and Ensemble Calibration,2025,10.14201/adcaij.32209,https://doi.org/10.14201/adcaij.32209,active learning robotics uncertainty ensemble,"The rising prevalence of diabetes has made Diabetic Retinopathy (DR) a major cause of blindness, underscoring the necessity for a computer-aided diagnostic system that can support clinical diagnoses without requiring extensive human effort. Many researchers have turned to deep learning to create automated screening and diagnostic tools for DR. However, for such systems to be truly effective in clinical practice, they must provide highly accurate assessments and well-calibrated estimates of uncertainty. Unfortunately, deep neural networks often tend to be overconfident in their predictions and are not easily amenable to probabilistic approaches. In our study, we introduce a novel approach for evaluating diagnostic uncertainty in DR predictions by employing ensemble-based calibration techniques. What sets our approach apart from cutting-edge convolutional neural network models is our use o",model-disagreement|uncertainty|sim2real,3,transfer under dynamics mismatch,ensemble disagreement,uncertainty scores are calibrated enough to guide action,ensembles disagree numerically without identifying a physical test,can collapse into a standard uncertainty bonus,which physical observation would actually distinguish the candidate models?
A High-Fidelity Multi-Objective Evaluation Framework for Power Transformers: Ensemble Learning with Uncertainty Quantification,2025,10.2139/ssrn.5856829,https://doi.org/10.2139/ssrn.5856829,active learning robotics uncertainty ensemble,,model-disagreement|uncertainty,3,choosing robot actions under model uncertainty,ensemble disagreement,uncertainty scores are calibrated enough to guide action,ensembles disagree numerically without identifying a physical test,can collapse into a standard uncertainty bonus,which physical observation would actually distinguish the candidate models?
Deep active genetic learning with evidential uncertainty for agriculture crops and lake water quality assessment,2025,10.54014/22c3-k94e,https://doi.org/10.54014/22c3-k94e,active learning robotics uncertainty ensemble,,uncertainty|active-probing,3,choosing robot actions under model uncertainty,active data acquisition,uncertainty scores are calibrated enough to guide action,"query cost, unsafe probes, and exploration bias",can collapse into a standard uncertainty bonus,which physical observation would actually distinguish the candidate models?
"Adaptive, Distribution-Free Uncertainty Quantification for Shear and Stoneley Wave Prediction Using Conformalized Ensemble Learning",2025,10.2118/229490-ms,https://doi.org/10.2118/229490-ms,active learning robotics uncertainty ensemble,"Abstract The acquisition of shear (DTS) and Stoneley (DTST) wave transit times is indispensable for comprehensive reservoir characterization, yet it is often constrained by significant economic and operational limitations. This data gap has spurred the development of data-driven prediction models; however, a critical ""credibility gap"" persists. While modern machine learning (ML) models routinely achieve high point-accuracy metrics such as the coefficient of determination (R2), these metrics alone do not guarantee geologically plausible or reliable predictions for high-stakes engineering decisions, including wellbore stability analysis and hydraulic fracture design. This paper directly addresses this credibility gap by introducing and validating a robust and reliable workflow that moves beyond deterministic point estimates to provide rigorous, probabilistic forecasts. The proposed methodo",model-disagreement|uncertainty,3,choosing robot actions under model uncertainty,ensemble disagreement,uncertainty scores are calibrated enough to guide action,ensembles disagree numerically without identifying a physical test,can collapse into a standard uncertainty bonus,which physical observation would actually distinguish the candidate models?
Active Operator Learning with Predictive Uncertainty Quantification for Partial Differential Equations,2025,10.2139/ssrn.5179254,https://doi.org/10.2139/ssrn.5179254,active learning robotics uncertainty ensemble,,uncertainty|active-probing,3,choosing robot actions under model uncertainty,active data acquisition,uncertainty scores are calibrated enough to guide action,"query cost, unsafe probes, and exploration bias",can collapse into a standard uncertainty bonus,which physical observation would actually distinguish the candidate models?
Integrating Stacking-Ensemble Feature Selection with Gru-Based Self-Supervised Learning for Precision and Uncertainty-Aware Steam Flow Forecasting,2025,10.2139/ssrn.5188272,https://doi.org/10.2139/ssrn.5188272,active learning robotics uncertainty ensemble,,model-disagreement|uncertainty,3,choosing robot actions under model uncertainty,ensemble disagreement,uncertainty scores are calibrated enough to guide action,ensembles disagree numerically without identifying a physical test,can collapse into a standard uncertainty bonus,which physical observation would actually distinguish the candidate models?
Phish-View: A Feature Rich Meta Ensemble Learning for Accurate and Uncertainty Aware Phishing Detection,2025,10.22266/ijies2025.0831.14,https://doi.org/10.22266/ijies2025.0831.14,active learning robotics uncertainty ensemble,,model-disagreement|uncertainty,3,choosing robot actions under model uncertainty,ensemble disagreement,uncertainty scores are calibrated enough to guide action,ensembles disagree numerically without identifying a physical test,can collapse into a standard uncertainty bonus,which physical observation would actually distinguish the candidate models?
Daily Land Surface Temperature Reconstruction in Landsat Cross-Track Areas Using Deep Ensemble Learning With Uncertainty Quantification_supp1-3643985.pdf,2025,10.1109/tgrs.2025.3643985/mm1,https://doi.org/10.1109/tgrs.2025.3643985/mm1,active learning robotics uncertainty ensemble,,model-disagreement|uncertainty,3,choosing robot actions under model uncertainty,ensemble disagreement,uncertainty scores are calibrated enough to guide action,ensembles disagree numerically without identifying a physical test,can collapse into a standard uncertainty bonus,which physical observation would actually distinguish the candidate models?
Uncertainty Reduction in Automated Rula Ergonomic Assessment Using Ensemble of Deep Learning Based Human Pose Estimation Models,2025,10.2139/ssrn.5354741,https://doi.org/10.2139/ssrn.5354741,active learning robotics uncertainty ensemble,,model-disagreement|uncertainty,3,choosing robot actions under model uncertainty,ensemble disagreement,uncertainty scores are calibrated enough to guide action,ensembles disagree numerically without identifying a physical test,can collapse into a standard uncertainty bonus,which physical observation would actually distinguish the candidate models?
Vendi Information Gain for Active Learning and its Application to Ecology,2025,10.32942/x23d2f,https://doi.org/10.32942/x23d2f,active learning robotics uncertainty ensemble,"While monitoring biodiversity through camera traps has become an important endeavor for ecological research, identifying species in the captured image data remains a major bottleneck due to limited labeling resources. Active learning—a machine learning paradigm that selects the most informative data to label and train a predictive model—offers a promising solution, but typically focuses on uncertainty in the individual predictions without considering uncertainty across the entire dataset. We introduce a new active learning policy, Vendi information gain (VIG), that selects images based on their impact on dataset-wide prediction uncertainty, capturing both informativeness and diversity. Applied to the Snapshot Serengeti dataset, VIG achieves impressive predictive accuracy close to full supervision using less than 10% of the labels. It consistently outperforms standard baselines across met",world-model|uncertainty|active-probing|planning-control,3,choosing robot actions under model uncertainty,active data acquisition,uncertainty scores are calibrated enough to guide action,"query cost, unsafe probes, and exploration bias",can collapse into a standard uncertainty bonus,which physical observation would actually distinguish the candidate models?
Uncertainty Quantification in Machine Learning Using an Ensemble Approach with Gaussian Process Regression,2025,10.4271/2025-01-8199,https://doi.org/10.4271/2025-01-8199,active learning robotics uncertainty ensemble,"&lt;div class=""section abstract""&gt;&lt;div class=""htmlview paragraph""&gt;Machine learning has witnessed widespread adoption across various domains, bringing about transformative changes in decision-making, trend prediction, task automation, and personalized experiences. Despite the remarkable predictive capabilities of machine learning models, the associated uncertainty in their predictions remains a critical concern. Uncertainty estimation plays a pivotal role in ensuring robust decision-making, going beyond mere outcome prediction to quantify the model's confidence and potential error. This paper first presents a review of existing uncertainty quantification techniques in machine learning, including Monte Carlo dropout and ensemble methods, highlighting their advantages in addressing uncertainty as well as their limitations. Then, it presents an efficient and fast novel technique for ",model-disagreement|uncertainty,3,choosing robot actions under model uncertainty,ensemble disagreement,uncertainty scores are calibrated enough to guide action,ensembles disagree numerically without identifying a physical test,can collapse into a standard uncertainty bonus,which physical observation would actually distinguish the candidate models?
DURABLE-RL: A Dynamic Uncertainty-aware Hybrid Reinforcement Learning Framework with Adaptive Buffer and Ensemble Modelling,2025,10.22266/ijies2025.1031.32,https://doi.org/10.22266/ijies2025.1031.32,active learning robotics uncertainty ensemble,,model-disagreement|uncertainty,3,choosing robot actions under model uncertainty,ensemble disagreement,uncertainty scores are calibrated enough to guide action,ensembles disagree numerically without identifying a physical test,can collapse into a standard uncertainty bonus,which physical observation would actually distinguish the candidate models?
FUZZY ENSEMBLE EMBEDDING LEARNING (FEEL): A CLASSIFIER-AGNOSTIC FRAMEWORK FOR UNCERTAINTY-AWARE AND CALIBRATED DECISION-MAKING,2025,10.12732/ijam.v38i9s.891,https://doi.org/10.12732/ijam.v38i9s.891,active learning robotics uncertainty ensemble,"Uncertainty and vagueness are inherent in real-world data, particularly in domains such as healthcare, finance, and natural language processing. Traditional machine learning models, which rely on crisp features and hard decision boundaries, often struggle to capture such ambiguity. This paper introduces Fuzzy Ensemble Embedding Learning (FEEL), a novel fuzzy methodology that integrates fuzzy embeddings, entropy-based ensemble integration, and fuzzy-aware regularization into a unified framework. FEEL represents features through multi-membership fuzzy embeddings, dynamically weights classifiers using fuzzy entropy, and penalizes overconfident predictions in vague regions. Experimental validation is performed on benchmark datasets including UCI Vertigo, Breast Cancer, Credit Scoring, and MNIST with noisy labels. This study results demonstrate that FEEL consistently outperforms standard clas",model-disagreement|uncertainty,3,choosing robot actions under model uncertainty,ensemble disagreement,uncertainty scores are calibrated enough to guide action,ensembles disagree numerically without identifying a physical test,can collapse into a standard uncertainty bonus,which physical observation would actually distinguish the candidate models?
Editor Note to article entitled “Leveraging Bayesian deep learning and ensemble methods for uncertainty quantification in image classification: A ranking-based approach”,2025,10.1016/j.heliyon.2025.e43825,https://doi.org/10.1016/j.heliyon.2025.e43825,active learning robotics uncertainty ensemble,,model-disagreement|uncertainty,3,choosing robot actions under model uncertainty,ensemble disagreement,uncertainty scores are calibrated enough to guide action,ensembles disagree numerically without identifying a physical test,can collapse into a standard uncertainty bonus,which physical observation would actually distinguish the candidate models?
e-FlowPrint: Enhanced FlowPrint for Robust Unknown Traffic Detection Using Uncertainty Measures Inspired by Active Learning,2025,10.20944/preprints202504.0946.v1,https://doi.org/10.20944/preprints202504.0946.v1,active learning robotics uncertainty ensemble,"The increasing prevalence of encryption enhances network traffic confidentiality and integrity but complicates network management and security by obscuring traffic flows. This challenge makes detecting cyberattacks and enforcing policies increasingly difficult. Encrypted Traffic Intelligence (ETI), particularly network traffic classification (NTC), offers solutions using machine learning techniques. However, practical implementation remains challenging due to the inherent complexity of network environments, where traffic feature distributions vary because of factors such as network topology and delay. This variability undermines the robustness of classifiers trained on static datasets. Moreover, dynamic environments increase the likelihood of encountering unknown traffic, where inaccurate identification can lead to high false positive rates, unacceptable in critical applications like bil",uncertainty|active-probing,3,choosing robot actions under model uncertainty,active data acquisition,uncertainty scores are calibrated enough to guide action,"query cost, unsafe probes, and exploration bias",can collapse into a standard uncertainty bonus,which physical observation would actually distinguish the candidate models?
Uncertainty-Aware Diabetic Retinopathy Detection via Ensemble Bayesian Deep Learning,2025,10.1109/icic68258.2025.11413155,https://doi.org/10.1109/icic68258.2025.11413155,active learning robotics uncertainty ensemble,,model-disagreement|uncertainty,3,choosing robot actions under model uncertainty,ensemble disagreement,uncertainty scores are calibrated enough to guide action,ensembles disagree numerically without identifying a physical test,can collapse into a standard uncertainty bonus,which physical observation would actually distinguish the candidate models?
Uncertainty-Aware Ensemble Learning for Cardiovascular Risk Assessment: A Comparative Study with Clinical Decision Support Integration,2025,10.1109/iceca66444.2025.11383284,https://doi.org/10.1109/iceca66444.2025.11383284,active learning robotics uncertainty ensemble,,model-disagreement|uncertainty,3,choosing robot actions under model uncertainty,ensemble disagreement,uncertainty scores are calibrated enough to guide action,ensembles disagree numerically without identifying a physical test,can collapse into a standard uncertainty bonus,which physical observation would actually distinguish the candidate models?
Edge-Aware Possibilistic Clustering with Uncertainty-Weighted Ensemble Learning for Land Cover Mapping,2025,10.23940/ijpe.25.10.p2.549558,https://doi.org/10.23940/ijpe.25.10.p2.549558,active learning robotics uncertainty ensemble,,model-disagreement|uncertainty,3,choosing robot actions under model uncertainty,ensemble disagreement,uncertainty scores are calibrated enough to guide action,ensembles disagree numerically without identifying a physical test,can collapse into a standard uncertainty bonus,which physical observation would actually distinguish the candidate models?
Double-Feedback: Enhancing Large Language Models Reasoning in Robotic Tasks by Knowledge Graphs_supp1-3562776.mp4,2025,10.1109/lra.2025.3562776/mm1,https://doi.org/10.1109/lra.2025.3562776/mm1,physics reasoning robot world models,,general-robot-learning,3,choosing robot actions under model uncertainty,learned predictive representation,uncertainty scores are calibrated enough to guide action,miscalibration under embodied distribution shift,can collapse into a standard uncertainty bonus,which physical observation would actually distinguish the candidate models?
Good reasoning needn’t make you an unfeeling robot,2025,10.64628/aa.9merndyfk,https://doi.org/10.64628/aa.9merndyfk,physics reasoning robot world models,,general-robot-learning,3,choosing robot actions under model uncertainty,learned predictive representation,uncertainty scores are calibrated enough to guide action,miscalibration under embodied distribution shift,can collapse into a standard uncertainty bonus,which physical observation would actually distinguish the candidate models?
Cooperative Active Learning-Based Dual Control for Exploration and Exploitation in Autonomous Search,2025,10.1109/tnnls.2024.3349467,https://doi.org/10.1109/tnnls.2024.3349467,robot exploration uncertainty active learning,,active-probing|planning-control,3,choosing robot actions under model uncertainty,active data acquisition,uncertainty scores are calibrated enough to guide action,"query cost, unsafe probes, and exploration bias",can collapse into a standard uncertainty bonus,which physical observation would actually distinguish the candidate models?
Uncertainty-Aware Progressive Exploration Learning for Semi-Supervised Surface Object Detection,2025,10.2139/ssrn.5242853,https://doi.org/10.2139/ssrn.5242853,robot exploration uncertainty active learning,,uncertainty|active-probing,3,choosing robot actions under model uncertainty,active data acquisition,uncertainty scores are calibrated enough to guide action,miscalibration under embodied distribution shift,can collapse into a standard uncertainty bonus,which physical observation would actually distinguish the candidate models?
An efficient surrogate modeling method for high dimensional uncertainty propagation via deep Bayesian active learning,2025,10.2139/ssrn.5895135,https://doi.org/10.2139/ssrn.5895135,robot exploration uncertainty active learning,,uncertainty|active-probing,3,choosing robot actions under model uncertainty,Bayesian uncertainty,uncertainty scores are calibrated enough to guide action,"query cost, unsafe probes, and exploration bias",can collapse into a standard uncertainty bonus,which physical observation would actually distinguish the candidate models?
Disagreement serves an explainable ensemble model based on Dempster–Shafer evidence-fusion for an improved skin lesion classification,2024,10.1016/j.bspc.2024.106761,https://doi.org/10.1016/j.bspc.2024.106761,robot world model ensemble disagreement,,model-disagreement,3,choosing robot actions under model uncertainty,ensemble disagreement,uncertainty scores are calibrated enough to guide action,ensembles disagree numerically without identifying a physical test,can collapse into a standard uncertainty bonus,which physical observation would actually distinguish the candidate models?
Emotional Design of Elderly Companion Robot Based on KANO Model,2024,10.1109/wrrc62201.2024.10696566,https://doi.org/10.1109/wrrc62201.2024.10696566,robot world model ensemble disagreement,,general-robot-learning,3,choosing robot actions under model uncertainty,learned predictive representation,uncertainty scores are calibrated enough to guide action,miscalibration under embodied distribution shift,can collapse into a standard uncertainty bonus,which physical observation would actually distinguish the candidate models?
Uncertainty-Aware Trajectory Planning: Using Uncertainty Quantification and Propagation in Traversability Prediction of Planetary Rovers,2024,10.1109/mra.2023.3341289,https://doi.org/10.1109/mra.2023.3341289,embodied uncertainty planning robot model disagreement,,uncertainty|planning-control,3,planning with learned predictive models,learned predictive representation,uncertainty scores are calibrated enough to guide action,miscalibration under embodied distribution shift,can collapse into a standard uncertainty bonus,which physical observation would actually distinguish the candidate models?
